{
  "fixture_id": "14-valuation-date-mtd",
  "base_currency": "CNY",
  "scenarios": [
    {
      "scenario_id": "normal",
      "kind": "normal",
      "commands": [
        {
          "command_id": "cmd-14-normal-01",
          "command_type": "get_overview",
          "data": {
            "valuation_date": "2026-03-15",
            "period_mode": "mtd",
            "events": [
              {
                "effective_date": "2026-03-01",
                "amount": "10.00"
              },
              {
                "effective_date": "2026-03-15",
                "amount": "20.00"
              },
              {
                "effective_date": "2026-03-16",
                "amount": "30.00"
              }
            ]
          }
        }
      ]
    },
    {
      "scenario_id": "boundary",
      "kind": "boundary",
      "commands": [
        {
          "command_id": "cmd-14-boundary-01",
          "command_type": "get_overview",
          "data": {
            "valuation_date": "2026-03-01",
            "period_mode": "mtd",
            "events": [
              {
                "effective_date": "2026-03-01",
                "amount": "10.00"
              }
            ]
          }
        }
      ]
    },
    {
      "scenario_id": "failure",
      "kind": "failure",
      "commands": [
        {
          "command_id": "cmd-14-failure-01",
          "command_type": "get_overview",
          "data": {
            "valuation_date": "2026-02-30",
            "period_mode": "mtd"
          }
        }
      ]
    }
  ],
  "canonical_hash": "sha256:cc81631b91bacfb429035d4ab62486210be9c49e7fc4b7b1dedc023466fcd4b6"
}
